research/reports/skew_v1/alpha_report_summary.csv

factor_name,dimension,role,rank_ic_mean,icir,hl_sharpe,hl_annu_ret,hl_avg_turnover,universe_ic_min,universe_ic_max,monotonicity_score,ic_positive_ratio
AlphaSKEW20,HM,base,0.02472972151703521,4.778335543119544,1.4224044307662347,0.1684315340656026,0.7117965207692073,0.010588064488213589,0.02472972151703521,0.7,0.6348005502063274
AlphaIdioSKEW60,HM,base,0.02031098668718731,4.941430154300497,1.8073268579966435,0.16009991291288048,0.2980022907954167,0.012268668006504072,0.02031098668718731,0.7,0.6279229711141678

research/reports/skew_v1/alpha_reports/AlphaSKEW20/report/report.md

## ALL-universe summary

- **factor_name**: AlphaSKEW20
- **universe**: ALL
- **rank_ic_mean**: 0.0247
- **abs_rank_ic_mean**: 0.0247
- **icir**: 4.7783
- **ic_positive_ratio**: 0.6348
- **hl_sharpe**: 1.4224
- **hl_annu_ret**: 0.1684
- **hl_mdd**: -0.1506
- **hl_avg_turnover**: 0.7118
- **implied_annu_fee**: 0.1335
- **direction**: 1
- **monotonicity_score**: 0.7000
- **stats_title**: H-L, Direction: 1, AnnuRet: 16.84%,Sharpe_Ratio: 1.42, MDD: -15.06%, Daily Turnover: 0.71,
 Implied AnnuFee(7.5%): 13.35%, Daily IC: 0.0247, Annu ICIR: 4.78